date,title,summary,topic,media,link
2022-08-23 00:00:00,Reubican el histórico puente de Río Blanco en Naguabo,La estructura de metal fue reemplazada por un puente permanente en hormigón,Locales,El Nuevo Dia,https://www.elnuevodia.com/noticias/locales/notas/reubican-el-historico-puente-de-rio-blanco-en-naguabo/
2022-08-23 00:00:00,Salud abre línea telefónica para orientar sobre la viruela del mono,También anuncia eventos de vacunación contra la enfermedad y detalla cuáles son los grupos en riesgo a contagio,Locales,El Nuevo Dia,https://www.elnuevodia.com/noticias/locales/notas/salud-abre-linea-telefonica-para-orientar-sobre-la-viruela-del-mono/
2022-08-23 00:00:00,The Outlets at Montehiedra abrirá centro de cirugía urológica más grande del Caribe,"Urology Hub, que ya opera una clínica en el centro comercial, inaugurará un segundo espacio exclusivo para procedimientos ambulatorios  ",Para suscriptores,El Nuevo Dia,https://www.elnuevodia.com/negocios/empresas-comercios/notas/the-outlets-at-montehiedra-abrira-centro-de-cirugia-urologica-mas-grande-del-caribe/
2022-08-23 00:00:00,Elvis Crespo reacciona al nuevo video de Bad Bunny inspirado en “Suavemente”,"El cantante de merengue hizo declaraciones en su ‘fan page” de Facebook, a través del cual le agradeció al exponente urbano",Música,El Nuevo Dia,https://www.elnuevodia.com/entretenimiento/musica/notas/elvis-crespo-reacciona-al-nuevo-video-de-bad-bunny-inspirado-en-suavemente/
2022-08-23 00:00:00,Pedro Pierluisi: “LUMA no va a contar con mi apoyo como gobernador a menos que se den los cambios que he pedido”,"En momentos en que se cocina una posible manifestación para exigir la cancelación del contrato, el primer ejecutivo exige acción inmediata de la empresa ",Gobierno,El Nuevo Dia,https://www.elnuevodia.com/noticias/gobierno/notas/pedro-pierluisi-luma-no-va-a-contar-con-mi-apoyo-como-gobernador-a-menos-que-se-den-los-cambios-que-he-pedido/
2022-08-23 00:00:00,"Universidad pública: transparente, diversa y justa","¿Qué datos debería ofrecer la universidad pública sobre su aportación a la vida y bienestar de todos los ciudadanos? ¿Cómo los ciudadanos se benefician de todo lo que pasa dentro la universidad?, escribe Myrna Rivas Nina",Para suscriptores,El Nuevo Dia,https://www.elnuevodia.com/opinion/punto-de-vista/universidad-publica-transparente-diversa-y-justa/
2022-08-23 00:00:00,Policías estatales comienzan a patrullar con cámaras corporales,"Los primeros 20 oficiales recibieron ayer su certificación y equipo, que ya está en uso por agentes de Patrullas de Carreteras",Seguridad,El Nuevo Dia,https://www.elnuevodia.com/noticias/seguridad/notas/policias-estatales-comienzan-a-patrullar-con-camaras-corporales/
2022-08-23 00:00:00,JetBlue ofrece boletos aéreos desde $39,La oferta de la aerolínea aplica a los vuelos de ida y se extenderá hasta el 30 de agosto,Turismo,El Nuevo Dia,https://www.elnuevodia.com/negocios/turismo/notas/jetblue-ofrece-boletos-aereos-desde-39/
2022-08-23 00:00:00,Reabre en Disney World el lujoso restaurante Victoria & Albert’s,"El elegante restaurante, ubicado en el Grand Floridian Resort & Spa, es el único en la Florida merecedor de los reconocimientos AAA Five Diamond Award desde el 2000",Parques temáticos,El Nuevo Dia,https://www.elnuevodia.com/de-viaje/parques-tematicos/notas/reabre-en-disney-world-el-lujoso-restaurante-victoria-alberts/
2022-08-23 00:00:00,Fin a la novela de Kevin Durant: se quedará en los Nets para la próxima temporada ,"Tras solicitar un cambio, el estelar canastero y la gerencia de Brooklyn anunciaron que permanecerán juntos al menos una campaña más ",Baloncesto,El Nuevo Dia,https://www.elnuevodia.com/deportes/baloncesto/notas/fin-a-la-novela-de-kevin-durant-se-quedara-en-los-nets-para-la-proxima-temporada/
2022-08-23 00:00:00,Una verdadera agenda por la educación en Puerto Rico,"Se necesita una agenda de atención a los problemas más urgentes de nuestro sistema educativo que esté centrada en tres áreas principales: el estudiante, el magisterio y las comunidades escolares, escribe Víctor Bonilla",Para suscriptores,El Nuevo Dia,https://www.elnuevodia.com/opinion/punto-de-vista/una-verdadera-agenda-por-la-educacion-en-puerto-rico/
2022-08-23 00:00:00,La viruela del mono y el HIV: puntos de inflexión,"Hoy, como el 1981, estamos enfrentando una enfermedad con todas las posibilidades de volverse una pandemia global, y también vemos que se quiere endilgarle al colectivo LGBBTTQI+ la aparición, propagación y causantes de estas condiciones, escribe Mario Paulino Payano",Para suscriptores,El Nuevo Dia,https://www.elnuevodia.com/opinion/punto-de-vista/la-viruela-del-mono-y-el-hiv-puntos-de-inflexion/
2022-08-23 00:00:00,Meteorología emite advertencia de inundaciones urbanas para varios pueblos,"Una vaguada provocará durante esta tarde aguaceros de moderados a intensos, con tronadas aisladas",El Tiempo,El Nuevo Dia,https://www.elnuevodia.com/noticias/el-tiempo/notas/meteorologia-emite-advertencia-de-inundaciones-urbanas-para-varios-pueblos/
2022-08-23 00:00:00,Juez federal autoriza modificar la libertad bajo fianza de Sixto George,"El productor televisivo, acusado de extorsión y obstrucción a la justicia, solicitó los cambios para poder trabajar en dos proyectos",Tribunales,El Nuevo Dia,https://www.elnuevodia.com/noticias/tribunales/notas/juez-federal-autoriza-modificar-la-libertad-bajo-fianza-de-sixto-george/
2022-08-23 00:00:00,La Asociación de Laboratorios Clínicos le exige a ASES espacio en la negociación sobre tarifas y cubiertas frente a las aseguradoras ,La entidad denunció que múltiples querellas sometidas y no atendidas por ASES representan una deuda estimada en más de $200 millones,Locales,El Nuevo Dia,https://www.elnuevodia.com/noticias/locales/notas/la-asociacion-de-laboratorios-clinicos-le-exige-a-ases-espacio-en-la-negociacion-sobre-tarifas-y-cubiertas-frente-a-las-aseguradoras/
2022-08-25 00:00:00,"Vladimir Putin ordena a las fuerzas armadas a reclutar 137,000 soldados más",El decreto presidencial se da en momentos en que el país intensifica su acción militar en Ucrania,Mundo,El Nuevo Dia,https://www.elnuevodia.com/noticias/mundo/notas/vladimir-putin-ordena-a-las-fuerzas-armadas-a-reclutar-137000-soldados-mas/
2022-08-25 00:00:00,Crean un embrión con células madre de un ratón,Tiene cerebro y un corazón que late. Así fue cómo los científicos lo hicieron.,Otros,El Nuevo Dia,https://www.elnuevodia.com/ciencia-ambiente/otros/notas/crean-un-embrion-con-celulas-madre-de-un-raton/
2022-08-25 00:00:00,Colegio de Médicos denuncia que la vida de miles de pacientes peligra cada vez que ocurre un apagón,"El doctor Carlos Díaz Vélez, presidente del organismo, advirtió que la salud de muchas personas, especialmente poblaciones vulnerables, se trastoca por las fallas en el servicio eléctrico",Locales,El Nuevo Dia,https://www.elnuevodia.com/noticias/locales/notas/colegio-de-medicos-denuncia-que-la-vida-de-miles-de-pacientes-peligra-cada-vez-que-ocurre-un-apagon/
2022-08-25 00:00:00,De Frente al Alzheimer Inc. celebrará evento dedicado a pacientes y sus cuidadores,"La fundación invita a participar de “The Longest Day por el Alzheimer”, en el Paseo Lineal en Bayamón",Salud,El Nuevo Dia,https://www.elnuevodia.com/estilos-de-vida/salud/notas/de-frente-al-alzheimer-inc-celebrara-evento-dedicado-a-pacientes-y-sus-cuidadores/
2022-08-25 00:00:00,Comienza la vendimia en la Denominación de Origen Rueda,La ausencia de lluvias hace que la uva tenga un estado sanitario óptimo,Barras y coctelería,El Nuevo Dia,https://www.elnuevodia.com/gastronomia/barras-cocteleria/notas/comienza-la-vendimia-en-la-denominacion-de-origen-rueda/
2022-08-25 00:00:00,LUMA Energy created a group to address outages but did not announce team management changes,"According to the head of the consortium’s parent company, they will be subject to “evaluation”",For Subscribers,El Nuevo Dia,https://www.elnuevodia.com/english/news/story/luma-energy-created-a-group-to-address-outages-but-did-not-announce-team-management-changes/
2022-08-25 00:00:00,"Camilo, Carlos Vives y Maluma confirman su participación en los Premios Billboard de la Música Latina","La gala, en la que el puertorriqueño Bad Bunny parte como favorito al sumar 23 nominaciones, se celebrará el próximo 29 de septiembre en el Watsco Center de Coral Gables Florida ",Música,El Nuevo Dia,https://www.elnuevodia.com/entretenimiento/musica/notas/camilo-carlos-vives-y-maluma-confirman-su-participacion-en-los-premios-billboard-de-la-musica-latina/
2022-08-25 00:00:00,"Novak Djokovic, sin vacunarse, no disputará el Abierto de Estados Unidos","El estelar jugador serbio anunció su baja del torneo a través de las redes sociales, ya que no puede viajar a Estados Unidos",Tenis,El Nuevo Dia,https://www.elnuevodia.com/deportes/tenis/notas/novak-djokovic-sin-vacunarse-no-disputara-el-abierto-de-estados-unidos/
2022-08-25 00:00:00,Karol G rechazó interpretar un personaje de “Aquaman”,Las razones para no participar en la película de Hollywood se las explicó a Jorge Pabón “Molusco” en una entrevista para su canal de YouTube ,Música,El Nuevo Dia,https://www.elnuevodia.com/entretenimiento/musica/notas/karol-g-rechazo-interpretar-un-personaje-de-aquaman/
2022-08-25 00:00:00,Sebastián Yatra se une a otros famosos al tener su combo favorito en McDonald’s,El “Menú Yatra” está disponible desde ayer hasta el 30 de septiembre en todos los restaurantes de la cadena ubicados en la isla ,Restaurantes,El Nuevo Dia,https://www.elnuevodia.com/gastronomia/restaurantes/notas/sebastian-yatra-se-une-a-otros-famosos-al-tener-su-combo-favorito-en-mcdonalds/
2022-08-26 00:00:00,COVID-19: Salud reporta 10 nuevas muertes y 355 hospitalizaciones,"Entre los pacientes hospitalizados, hay 56 menores de edad",Locales,El Nuevo Dia,https://www.elnuevodia.com/noticias/locales/notas/covid-19-salud-reporta-10-nuevas-muertes-y-355-hospitalizaciones/
2022-08-26 00:00:00,"Moa, el hijo de Jerry Rivera, debuta en la salsa con “Tocando fondo” ",El tema se encuentra disponible en todas las plataformas digitales de música ,Música,El Nuevo Dia,https://www.elnuevodia.com/entretenimiento/musica/notas/moa-el-hijo-de-jerry-rivera-debuta-en-la-salsa-con-tocando-fondo/
2022-08-26 00:00:00,Tremont Waters fue el héroe en su debut en el Equipo Nacional: “Soy bendecido” ,El armador fue uno de cinco debutantes con Puerto Rico y en la importante posición de armador controló el juego para sacar el triunfo 75-72 sobre Brasil en el inicio de la segunda ronda para la clasificación al Mundial de FIBA 2023,Baloncesto,El Nuevo Dia,https://www.elnuevodia.com/deportes/baloncesto/notas/tremont-waters-fue-el-heroe-en-su-debut-en-el-equipo-nacional-soy-bendecido/
2022-08-26 00:00:00,Piden al DACO salvar la producción de café local,"La agencia evalúa los precios, mientras los caficultores temen que se pierda la cosecha si no se toma una acción rápida",Para suscriptores,El Nuevo Dia,https://www.elnuevodia.com/negocios/agro/notas/piden-al-daco-salvar-la-produccion-de-cafe-local/
2022-08-26 00:00:00,Construcción de estacionamiento soterrado para el hotel Normandie necesitará aval federal,"El dueño de la propiedad, Ezra “Eddie” Ishay, condicionó el éxito de la hospedería al proyecto que se desarrollaría en El Escambrón, así como al acceso directo a la playa",Para suscriptores,El Nuevo Dia,https://www.elnuevodia.com/negocios/turismo/notas/construccion-de-estacionamiento-soterrado-para-el-hotel-normandie-necesitara-aval-federal/
2022-08-26 00:00:00,Polémico vídeo en la primera vista pública sobre el aborto,La Comisión de lo Jurídico inició ayer las     audiencias para discutir cinco medidas relacionadas con derechos reproductivos  ,Legislatura,El Nuevo Dia,https://www.elnuevodia.com/noticias/legislatura/notas/polemico-video-en-la-primera-vista-publica-sobre-el-aborto/
2022-08-26 00:00:00,La UPR aboga por cambios a la reválida de Terapia Física ,"El Departamento de Salud da visto bueno a modificar el examen, y se estableció una moratoria ante los problemas de acreditación que atraviesan los programas de varias universidades",Locales,El Nuevo Dia,https://www.elnuevodia.com/noticias/locales/notas/la-upr-aboga-por-cambios-a-la-revalida-de-terapia-fisica/
2022-08-26 00:00:00,La cancelación de deudas estudiantiles representaría un alivio económico a largo plazo,Deudores en la isla prevén que la iniciativa anunciada por Biden permitirá reducir los pagos mensuales para saldar los préstamos que tomaron para estudiar,Locales,El Nuevo Dia,https://www.elnuevodia.com/noticias/locales/notas/la-cancelacion-de-deudas-estudiantiles-representaria-un-alivio-economico-a-largo-plazo/
2022-08-26 00:00:00,La “cobertura universal de salud”: ¿caballo de troya de la privatización?,"En el caso de Puerto Rico se ha documentado cómo más de $2,500 millones, tanto federales como estatales, van dirigidos al pago de primas a las aseguradoras privadas, escribe Nylca J. Muñoz Sosa",Para suscriptores,El Nuevo Dia,https://www.elnuevodia.com/opinion/punto-de-vista/la-cobertura-universal-de-salud-caballo-de-troya-de-la-privatizacion/
2022-08-26 00:00:00,Edgar Abraham cuenta cómo armó el “sonido fogoso” de la Orquesta Sinfónica Urbana,El debut de esta formación musical será parte de la celebración del primer aniversario del Distrito T-Mobile,Música,El Nuevo Dia,https://www.elnuevodia.com/entretenimiento/musica/notas/edgar-abraham-cuenta-como-armo-el-sonido-fogoso-de-la-orquesta-sinfonica-urbana/
2022-08-26 00:00:00,Receta: Arepa Reina Pepiada,Chef Leo Mendoza del restaurante Budaré nos comparte la receta de cómo hacer una auténtica arepa venezolana,Cocina con,El Nuevo Dia,https://www.elnuevodia.com/programas/cocina-con/notas/receta-arepa-reina-pepiada/
2022-08-26 00:00:00,Chef Leo Mendoza muestra su amor por las arepas y la cocina creativa,"Nacido en Venezuela, con más de 26 años en Puerto Rico, se destaca por su filosofía de “cocina de autor”, con la cual les brinda una experiencia única a sus clientes",Cocina con,El Nuevo Dia,https://www.elnuevodia.com/programas/cocina-con/notas/chef-leo-mendoza-muestra-su-amor-por-las-arepas-y-la-cocina-creativa/
2022-08-26 00:00:00,La presidenta de Taiwán denuncia que China y Rusia amenazan el orden mundial,Sus expresiones se dan en momentos en que China aumenta sus maniobras militares cerca de la isla asiática,Mundo,El Nuevo Dia,https://www.elnuevodia.com/noticias/mundo/notas/la-presidenta-de-taiwan-denuncia-que-china-y-rusia-amenazan-el-orden-mundial/
2022-08-26 00:00:00,Frankie Ruiz Jr.: “Mi papá es inimitable”,El hijo del fenecido salsero interpreterá varios del éxitos del fenecido Frankie Ruiz en el “Festival de Salsa” de Mayagüez,Música,El Nuevo Dia,https://www.elnuevodia.com/entretenimiento/musica/notas/frankie-ruiz-jr-mi-papa-es-inimitable/
2022-08-26 00:00:00,Encuentran el cuerpo baleado de un hombre de 28 años en la barriada Las Monjas de Hato Rey,La División de Homicidios del CIC de San Juan investiga las circunstancias que llevaron a la muerte de la víctima,Seguridad,El Nuevo Dia,https://www.elnuevodia.com/noticias/seguridad/notas/encuentran-el-cuerpo-baleado-de-un-hombre-en-la-barriada-las-monjas-de-hato-rey/
2022-08-26 00:00:00,Humedad de una onda tropical al sur de la isla provocará una tarde activa en aguaceros y tronadas,"Mientras, durante el día es posible que se experimenten índices de calor por encima de los 100 grados Fahrenheit en pueblos costeros y áreas urbanas",El Tiempo,El Nuevo Dia,https://www.elnuevodia.com/noticias/el-tiempo/notas/humedad-de-una-onda-tropical-al-sur-de-la-isla-provocara-una-tarde-activa-en-aguaceros-y-tronadas/
2022-08-26 00:00:00,Oferta culinaria por partida doble en Arecibo,"“Arasibo Steakhouse Boutique” y “La Güira” cuentan con sus respectivas identidades, pero coinciden en los renglones de calidad y consistencia",Restaurantes,El Nuevo Dia,https://www.elnuevodia.com/gastronomia/restaurantes/notas/oferta-culinaria-por-partida-doble-en-arecibo/
2022-08-26 00:00:00,Pierluisi tras enfrentamiento entre policías y manifestantes: “Toda agresión será investigada”,"Mientras, el comisionado de la Policía y el secretario de Seguridad Pública ofrecerán una conferencia de prensa a las 10:00 a.m. para reaccionar a señalamientos sobre el uso excesivo de la fuerza policial",Gobierno,El Nuevo Dia,https://www.elnuevodia.com/noticias/gobierno/notas/pierluisi-tras-enfrentamiento-entre-policias-y-manifestantes-toda-agresion-sera-investigada/
2022-08-26 00:00:00,La falta de energía eléctrica y la salud mental,"La falta de electricidad tiene consecuencias importantes que pueden afectar la salud física o mental, teniendo resultados más adversos a la salud de ciertos grupos, escribe Xavier Soto Ruiz",Para suscriptores,El Nuevo Dia,https://www.elnuevodia.com/opinion/punto-de-vista/la-falta-de-energia-electrica-y-la-salud-mental/
2022-08-26 00:00:00,Hermes Croatto emocionado por su debut en el teatro como parte del elenco de “Los García” ,"La integración del cantautor llega con el anuncio de la apertura de una quinta función el próximo domingo, 9 de octubre, en el Centro de Bellas Artes de Santurce",Farándula,El Nuevo Dia,https://www.elnuevodia.com/entretenimiento/farandula/notas/hermes-croatto-emocionado-por-su-debut-en-el-teatro-como-parte-del-elenco-de-los-garcia/
2022-08-26 00:00:00,Sabores de Oriente Medio en Ocean Park,"En “Tía Dora”, el chef Raúl Correa nos invita a conocer su más reciente aventura culinaria",Restaurantes,El Nuevo Dia,https://www.elnuevodia.com/gastronomia/restaurantes/notas/sabores-de-oriente-medio-en-ocean-park/
2022-08-26 00:00:00,TeleOnce estrenará programa con participación ciudadana   ," “Puerto Rico Habla en Jugando Pelota Dura”, además, tendrá un espacio donde se presentarán charlas con expertos en el tema de la edición, moderadas por la presentadora Deddie Romero",Televisión,El Nuevo Dia,https://www.elnuevodia.com/entretenimiento/television/notas/teleonce-estrenara-programa-con-participacion-ciudadana/
2022-08-26 00:00:00,Se nos fue el “último jíbaro”,"Me apenó su fatiga cultural. Sentí la lucha interna entre lo que fue su vida y ahora. Lo que le complicaba su decisión de buscar paz allá, y no acá. ‘Mi Puerto Rico ya no existe’, suspiró, relata Eudaldo Báez-Galib ",Para suscriptores,El Nuevo Dia,https://www.elnuevodia.com/opinion/punto-de-vista/se-nos-fue-el-ultimo-jibaro/
2022-08-26 00:00:00,¡A palo limpio! Los Yankees arrollan 13-4 a Oakland para conseguir su cuarta victoria al hilo,Giancarlo Stanton regresó a la alineación de Nueva York y remolcó tres carreras en el triunfo,Béisbol,El Nuevo Dia,https://www.elnuevodia.com/deportes/beisbol/notas/a-palo-limpio-los-yankees-arrollan-13-4-a-oakland-para-conseguir-su-cuarta-victoria-al-hilo/
2022-08-26 00:00:00,Fánaticos de Bad Bunny viajan a Nueva York en vuelo privado para su concierto en el Yankee Stadium,"El avión luce diseños emblemáticos del álbum “Un verano sin ti”, mientras los pasajeros pudieron disfrutar de bebidas como Blue Sky Colada o Moscow Mule, inspiradas en temas del artista",Música,El Nuevo Dia,https://www.elnuevodia.com/entretenimiento/musica/notas/fanaticos-de-bad-bunny-viajan-a-nueva-york-en-vuelo-privado-para-su-concierto-en-el-yankee-stadium/
2022-08-26 00:00:00,Repudian agresiones de la Policía contra periodistas y fotoperiodistas que cubrían la protesta contra LUMA,El comisionado Antonio López Figueroa se comprometió a revelar los resultados de una investigación que ya se inició contra los agentes implicados,Locales,El Nuevo Dia,https://www.elnuevodia.com/noticias/locales/notas/repudian-agresiones-de-la-policia-contra-periodistas-y-fotoperiodistas-que-cubrian-la-protesta-contra-luma/
2022-08-26 00:00:00,Sentencian a Joseph Fuentes a un año y dos meses de prisión por esquema para ocultar donantes,"El presidente de Salvemos a Puerto Rico, principal súper PAC a favor del gobernador Pedro Pierluisi, se declaró culpable el pasado 5 de mayo",Tribunales,El Nuevo Dia,https://www.elnuevodia.com/noticias/tribunales/notas/sentencian-a-joseph-fuentes-a-un-ano-y-dos-meses-de-prision-por-esquema-para-ocultar-donantes/
2022-08-26 00:00:00,Susan Soltero a Bad Bunny: “¡Te amo! Dos veces me has hecho inmortal”,"El exponente urbano utilizó la imagen de la periodista y meteoróloga para promocionar su más reciente sencillo, “Neverita” ",Música,El Nuevo Dia,https://www.elnuevodia.com/entretenimiento/musica/notas/susan-soltero-a-bad-bunny-te-amo-dos-veces-me-has-hecho-inmortal/
2022-08-26 00:00:00,Publican la declaración jurada con detalles del allanamiento a la casa de Donald Trump,"Aunque es una versión censurada, hay suficientes información para saber qué buscaban las autoridades en el complejo de Mar-a-Lago en Florida",Estados Unidos,El Nuevo Dia,https://www.elnuevodia.com/noticias/estados-unidos/notas/publican-la-declaracion-jurada-con-detalles-del-allanamiento-a-la-casa-de-donald-trump/
2022-08-26 00:00:00,Las autoridades evalúan radicación de cargos contra personas arrestadas en manifestación contra LUMA,"Dos personas fueron arrestadas y otras dos fueron citados para una manifestación anterior, incluyendo al activista Tito Kayak",Seguridad,El Nuevo Dia,https://www.elnuevodia.com/noticias/seguridad/notas/las-autoridades-evaluan-radicacion-de-cargos-contra-personas-arrestadas-en-manifestacion-contra-luma/
2022-08-26 00:00:00,Karol G y Maldy le ponen un toque de terror al perreo en “Gatúbela” ,"El video musical del segundo tema del 2022  de la colombiana fue filmado en Barcelona, España",Música,El Nuevo Dia,https://www.elnuevodia.com/entretenimiento/musica/notas/karol-g-y-maldy-le-ponen-un-toque-de-terror-al-perreo-en-gatubela/
2022-08-26 00:00:00,Empresarios boricuas buscan oportunidades de negocio en Colombia,Unas 28 empresas locales se unieron esta semana a la misión comercial que realizó el Departamento Económico y Comercio de Puerto Rico en el vecino país,Empresas y comercios,El Nuevo Dia,https://www.elnuevodia.com/negocios/empresas-comercios/notas/empresarios-boricuas-buscan-oportunidades-de-negocio-en-colombia/
2022-08-26 00:00:00,"En el inicio de clases, apostemos por la lectura","Convertir en prioridad que nuestros estudiantes sean lectores proficientes y críticos y reciban una educación de calidad, es invertir en el futuro social y económico de Puerto Rico, escribe Carlos Rodríguez Silvestre",Para suscriptores,El Nuevo Dia,https://www.elnuevodia.com/opinion/punto-de-vista/en-el-inicio-de-clases-apostemos-por-la-lectura/
2022-08-30 00:00:00,COVID-19: seis nuevas muertes y 307 hospitalizados es el nuevo saldo del virus,"Mientras, el Departamento de Salud informó que la tasa de positividad estaba a las 6:00 a.m. en 25.27%",Locales,El Nuevo Dia,https://www.elnuevodia.com/noticias/locales/notas/covid-19-seis-nuevas-muertes-y-307-hospitalizados-es-el-nuevo-saldo-del-virus/
2022-08-30 00:00:00,"En el tema de la salud, ¿cuál es el plan?","La salud en Puerto Rico necesita financiamiento mejor, estable y a largo plazo, escribe Jaime Pla",Para suscriptores,El Nuevo Dia,https://www.elnuevodia.com/opinion/punto-de-vista/en-el-tema-de-la-salud-cual-es-el-plan/
2022-08-30 00:00:00,La opción de bajar los requisitos de admisión en la UPR ante el reto demográfico,"Entre el 2010 y el 2022 el número de estudiantes en la UPR descendió en 32%. Hoy la UPR estudia la alternativa de omitir índices de ingreso ante la merma en la matrícula, escribe Vicente Feliciano",Para suscriptores,El Nuevo Dia,https://www.elnuevodia.com/opinion/punto-de-vista/la-opcion-de-bajar-los-requisitos-de-admision-en-la-upr-ante-el-reto-demografico/
2022-08-30 00:00:00,Gobierno de Biden no ve necesario anular doctrina de los Casos Insulares en reclamo sobre la ciudadanía de los samoanos,"“El argumento del gobierno no se basa en ese marco”, indicó el Departamento de Justicia de Estados Unidos, bajo críticas de congresistas y grupos pro derechos civiles",Washington D. C.,El Nuevo Dia,https://www.elnuevodia.com/corresponsalias/washington-dc/notas/gobierno-de-biden-no-ve-necesario-anular-doctrina-de-los-casos-insulares-en-reclamo-sobre-la-ciudadania-de-los-samoanos/
2022-08-30 00:00:00,Nueva temporada de conciertos en la continuación del 90 aniversario de Pro Arte Musical,La organización cultural ha diseñado un programa atractivo en propuestas de repertorio y participación de figuras internacionales destacadas  ,Música,El Nuevo Dia,https://www.elnuevodia.com/entretenimiento/musica/notas/nueva-temporada-de-conciertos-en-la-continuacion-del-90-aniversario-de-pro-arte-musical/
2022-08-30 00:00:00,Hacienda y Chris Agront todavía no llegan a un acuerdo,"El inicio del juicio en su fondo contra el empresario e influencer fue reseñalado la semana pasada para mañana, miércoles",Para suscriptores,El Nuevo Dia,https://www.elnuevodia.com/negocios/economia/notas/hacienda-y-chris-agront-todavia-no-llegan-a-un-acuerdo/
2022-08-30 00:00:00,Barceloneta: agenda con empuje  económico,La alcaldesa tiene como prioridad el desarrollo de empresas que activen la economía y atraigan otras fuentes de ingresos al pueblo,Locales,El Nuevo Dia,https://www.elnuevodia.com/noticias/locales/notas/barceloneta-agenda-con-empuje-economico/
2022-08-30 00:00:00,Aprueban medidas que acelerarían proceso de transición de cancelarse el contrato de LUMA ,"Legisladores del MVC, el PIP y el independiente José Vargas Vidot avalaron las medidas, aunque sin mucha esperanza de que resulten en verdaderas alternativas para atender la crisis energética",Locales,El Nuevo Dia,https://www.elnuevodia.com/noticias/locales/notas/aprueban-medidas-que-acelerarian-proceso-de-transicion-de-cancelarse-el-contrato-de-luma/
