date,title,summary,topic,media,link
2022-08-13 00:00:00,COVID-19: Salud reporta ocho nuevas muertes y 366 personas hospitalizadas,"Del total de hospitalizados, 45 son pacientes pediátricos y uno de ellos está en intensivo",Locales,El Nuevo Dia,https://www.elnuevodia.com/noticias/locales/notas/covid-19-salud-reporta-ocho-nuevas-muertes-y-366-personas-hospitalizadas/
2022-08-13 00:00:00,Delicado de salud el excampeón olímpico cubano Alberto Juantorena,El exatleta fue hospitalizado con un cuadro de bronconeumonía y descompensación cardiovascular,Otros deportes,El Nuevo Dia,https://www.elnuevodia.com/deportes/otros-deportes/notas/delicado-de-salud-el-excampeon-olimpico-cubano-alberto-juantorena/
2022-08-13 00:00:00,Restringen acceso a un tramo de playa Flamenco en Culebra para detonar un “proyectil explosivo”,"El artefacto fue hallado cerca del área del tanque militar. Autoridades estatales y federales se encuentran en el lugar atendiendo la emergencia, aunque aseguran que está “controlada”.",Seguridad,El Nuevo Dia,https://www.elnuevodia.com/noticias/seguridad/notas/restringen-acceso-a-la-playa-flamenco-en-culebra-para-detonar-un-proyectil-explosivo/
2022-08-13 00:00:00,U.S House passes budget reconciliation bill,The legislation - which now heads to President Biden´s desk for his signature - injects $369 billion in climate change measures and allows Medicare to directly negotiate prices with drug companies.,News,El Nuevo Dia,https://www.elnuevodia.com/english/news/story/us-house-passes-budget-reconciliation-bill/
2022-08-13 00:00:00,¡Y la ganadora es Miss Guaynabo!,"La historia está llena de ejemplos reales de que no hay que ser el ganador de un premio para prevalecer en lo importante, que es trascender. Ariana trasciende, escribe Byankah Sobá",Para suscriptores,El Nuevo Dia,https://www.elnuevodia.com/opinion/punto-de-vista/y-la-ganadora-es-miss-guaynabo/
2022-08-13 00:00:00,Muere un conductor de 25 años tras chocar con un poste en Río Piedras,"El accidente se reportó en la madrugada, en la avenida Barbosa",Seguridad,El Nuevo Dia,https://www.elnuevodia.com/noticias/seguridad/notas/muere-un-conductor-de-25-anos-tras-chocar-con-un-poste-en-rio-piedras/
2022-08-13 00:00:00,¡Qué difícil y costoso es ser mujer!,"Se imponen códigos estrictos a las mujeres y les exigen que deben preocuparse por su apariencia. Ser mujer es muy caro, escribe Martha Quiñones Domínguez   ",Para suscriptores,El Nuevo Dia,https://www.elnuevodia.com/opinion/punto-de-vista/que-dificil-y-costoso-es-ser-mujer/
2022-08-13 00:00:00,“Es una emoción que no podría describir”: De fiesta Corozal con el título de las Pinkin,El sexteto corozaleño barrió en cuatro juegos a Caguas en la final para alcanzar su título número 18 en la historia de la franquicia,Voleibol,El Nuevo Dia,https://www.elnuevodia.com/deportes/voleibol/notas/es-una-emocion-que-no-podria-describir-de-fiesta-corozal-con-el-titulo-de-las-pinkin/
2022-08-13 00:00:00,Más comedia que acción en “Day Shift”,Jamie Fox interpreta a un cazavampiros,Películas y series,El Nuevo Dia,https://www.elnuevodia.com/entretenimiento/peliculas-series/notas/mas-comedia-que-accion-en-day-shift/
2022-08-13 00:00:00,“Igor” González y los Toritos de Cayey se colocan a las puertas de la final del Béisbol Doble A,"La novena, que dirige el exjugador de las Mayores, domina la serie semifinal 3-0 ante Hormigueros, mientras Salinas viene de tomar la delantera 2-1 sobre Guaynabo",Béisbol,El Nuevo Dia,https://www.elnuevodia.com/deportes/beisbol/notas/igor-gonzalez-y-los-toritos-de-cayey-se-colocan-a-las-puertas-de-la-final-del-beisbol-doble-a/
2022-08-13 00:00:00,"Entre los jardines y la receptoría, el boricua MJ Meléndez se deja sentir con los Royals","Entre los novatos de ambas ligas, el joven pelotero de Kansas City figura entre los líderes de jonrones y carreras remolcadas",Béisbol,El Nuevo Dia,https://www.elnuevodia.com/deportes/beisbol/notas/entre-los-jardines-y-la-receptoria-el-boricua-mj-melendez-se-deja-sentir-con-los-royals/
2022-08-13 00:00:00,Aumenta a 50 el total de casos confirmados de viruela del mono en Puerto Rico ,"El Departamento de Salud informó hoy, sábado, de cinco contagios nuevos registrados por la agencia",Locales,El Nuevo Dia,https://www.elnuevodia.com/noticias/locales/notas/aumenta-a-50-el-total-de-casos-confirmados-de-viruela-del-mono-en-puerto-rico/
2022-08-13 00:00:00,El escritor Salman Rushdie sigue hospitalizado tras ataque,"El autor de 75 años sufrió heridas en el hígado, en los nervios de un brazo y en un ojo, dijo su agente",Estados Unidos,El Nuevo Dia,https://www.elnuevodia.com/noticias/estados-unidos/notas/el-escritor-salman-rushdie-sigue-hospitalizado-tras-ataque/
2022-08-13 00:00:00,Asesinan a tiros a dos hombres en hechos separados en Comerío y San Juan,"Con estas dos muertes violentas, aumentó a 367 el total de asesinatos reportados en lo que va de año",Seguridad,El Nuevo Dia,https://www.elnuevodia.com/noticias/seguridad/notas/asesinan-a-tiros-a-dos-hombres-en-hechos-separados-en-comerio-y-san-juan/
2022-08-14 00:00:00,LUMA Energy y la AEE exhortan a la ciudadanía a reducir el consumo de energía eléctrica para esta noche,Las averías de dos unidades en las plantas AES y Aguirre provocaron una reducción en la capacidad de generación de la Autoridad de Energía Eléctrica en lo que se completan las reparaciones,Locales,El Nuevo Dia,https://www.elnuevodia.com/noticias/locales/notas/luma-energy-y-la-aee-exhortan-a-la-ciudadania-a-reducir-el-consumo-de-energia-electrica-para-esta-noche/
2022-08-13 00:00:00,Voces del ciclismo hacen llamado a compartir la carretera tras la muerte de dos de los suyos en Manatí,"Amigos de Raúl Velázquez y Keisy Toro expresan a El Nuevo Día su dolor y hablan del reto que supone practicar esta actividad en la isla, al tiempo que expertos señalan posibles soluciones a fallas en la seguridad vial",Para suscriptores,El Nuevo Dia,https://www.elnuevodia.com/noticias/locales/notas/voces-del-ciclismo-hacen-llamado-a-compartir-la-carretera-tras-la-muerte-de-dos-de-los-suyos-en-manati/
2022-08-13 00:00:00,Variedad sonora en la primera noche del Coca Cola Music Fest   ,"Hoy se esperan las presentaciones de artistas como Cosculluela, Miky Woodz y Young Miko.",Música,El Nuevo Dia,https://www.elnuevodia.com/entretenimiento/musica/notas/variedad-sonora-en-la-primera-noche-del-coca-cola-music-fest/
2022-08-13 00:00:00,Persisten las versiones encontradas entre LUMA y AEE por apagón del viernes,El director ejecutivo de la AEE afirmó que “no hay duda” que la falla que afectó las centrales de Aguirre y AES se originó en la línea de transmisión,Locales,El Nuevo Dia,https://www.elnuevodia.com/noticias/locales/notas/persisten-las-versiones-encontradas-entre-luma-y-aee-por-apagon-del-viernes/
2022-08-13 00:00:00,El caso contra Wanda Vázquez: el peor de los crímenes,"La acusación contra Wanda Vázquez dice que puso al sistema bancario al servicio del lavado internacional de dinero. De probársele, puede ser el peor crimen cometido por un político en Puerto Rico, escribe Benjamín Torres Gotay",Para suscriptores,El Nuevo Dia,https://www.elnuevodia.com/opinion/las-cosas-por-su-nombre/el-caso-contra-wanda-vazquez-el-peor-de-los-crimenes/
2022-08-13 00:00:00,“Nos sorprendió a todos”: suspensión de Fernando Tatis Jr. impacta a los Padres y a las Grandes Ligas,La joven estrella dominicana pidió perdón a la organización de San Diego luego de ser sancionado por 80 partidos tras dar positivo a una droga para mejorar el rendimiento,Béisbol,El Nuevo Dia,https://www.elnuevodia.com/deportes/beisbol/notas/nos-sorprendio-a-todos-suspension-de-fernando-tatis-jr-impacta-a-los-padres-y-a-las-grandes-ligas/
2022-08-13 00:00:00,¿Qué factores dan origen a la fatiga y cómo afecta tu organismo?,"La fatiga muscular es la incapacidad o falta de fuerzas para continuar realizando una determinada actividad. Sucede cuando los músculos no tienen la fuerza suficiente para continuar, escribe José Cruz López",Para suscriptores,El Nuevo Dia,https://www.elnuevodia.com/opinion/desde-mi-perspectiva/que-factores-dan-origen-a-la-fatiga-y-como-afecta-tu-organismo/
2022-08-13 00:00:00,La creación de espacios abiertos y multifuncionales continúa ganando terreno en la arquitectura ,"Las tendencias para este 2022 enfatizan en la sensibilidad ecológica, el uso inteligente de los recursos a través de la tecnología y el retorno a lo esencial",Construcción,El Nuevo Dia,https://www.elnuevodia.com/negocios/construccion/notas/la-creacion-de-espacios-abiertos-y-multifuncionales-continua-ganando-terreno-en-la-arquitectura/
2022-08-13 00:00:00,Detonan proyectil de artillería que provocó el cierre de un tramo de la playa Flamenco en Culebra,"El artefacto, que fue hallado cerca del área del tanque militar, fue destruido mediante una demolición controlada con explosivos C4",Seguridad,El Nuevo Dia,https://www.elnuevodia.com/noticias/seguridad/notas/detonan-proyectil-de-artilleria-que-provoco-el-cierre-de-un-tramo-de-la-playa-flamenco-en-culebra/
2022-08-13 00:00:00,Hombre acusado de apuñalar al escritor Salman Rushdie somete alegato de inocencia,"El abogado de Hadi Matar, de 24 años, hizo la declaración en la corte en nombre de su cliente durante una breve audiencia de presentación formal de los cargos",Estados Unidos,El Nuevo Dia,https://www.elnuevodia.com/noticias/estados-unidos/notas/hombre-acusado-de-apunalar-al-escritor-salman-rushdie-somete-alegato-de-inocencia/
2022-08-14 00:00:00,Muere un conductor de 18 años tras impactar una valla de metal en Guánica,La Policía ocupó en la escena un arma de fuego y droga,Seguridad,El Nuevo Dia,https://www.elnuevodia.com/noticias/seguridad/notas/muere-un-conductor-de-18-anos-tras-impactar-una-valla-de-metal-en-guanica/
2022-08-14 00:00:00,Pedro Pierluisi designa a Anaís Rodríguez Vega como secretaria en propiedad del DRNA,"Por meses, la funcionaria había ocupado el cargo de manera interina tras la salida de Rafael Machargo",Gobierno,El Nuevo Dia,https://www.elnuevodia.com/noticias/gobierno/notas/pedro-pierluisi-designa-a-anais-rodriguez-vega-como-secretaria-en-propiedad-del-drna/
2022-08-14 00:00:00,Miguel Romero entiende que no debe demorar el fallo judicial sobre el parque de Condado,La demanda del municipio se mantiene en pie independiente a la de un grupo de ciudadanos,Gobierno,El Nuevo Dia,https://www.elnuevodia.com/noticias/gobierno/notas/miguel-romero-entiende-que-no-debe-demorar-el-fallo-judicial-sobre-el-parque-de-condado/
2022-08-14 00:00:00,Salman Rushdie está “en camino a la recuperación” tras ser apuñalado en Nueva York,El reconocido escritor de 75 años pudo hablar y bromear luego que médicos le retiraron un respirador artificial el sábado,Estados Unidos,El Nuevo Dia,https://www.elnuevodia.com/noticias/estados-unidos/notas/salman-rushdie-esta-en-camino-a-la-recuperacion-tras-ser-apunalado-en-nueva-york/
2022-08-14 00:00:00,"En Puerto Rico la medicina no es glamur, sino deuda y sacrificio","No podemos exigir lealtad unilateral de nuestra clase médica, escribe Juan S. Vidal Santiago",Punto de vista,El Nuevo Dia,https://www.elnuevodia.com/opinion/punto-de-vista/en-puerto-rico-la-medicina-no-es-glamur-sino-deuda-y-sacrificio/
2022-08-14 00:00:00,Nelson Colón y su hijo Michael: inseparables durante la postemporada del BSN,"El dirigente de los Vaqueros de Bayamón ha estado acompañado de su primogénito, quien vive en Nueva York pero pasó el verano en la isla con su padre en las canchas ",Baloncesto,El Nuevo Dia,https://www.elnuevodia.com/deportes/baloncesto/notas/nelson-colon-y-su-hijo-michael-inseparables-durante-la-postemporada-del-bsn/
2022-08-14 00:00:00,Comedia “La peor cantante del mundo” abre su cuarta función,"El público tendrá la oportunidad de disfrutar de la nueva función el domingo, 28 de agosto, en el Centro de Bellas Artes de Santurce",Cultura,El Nuevo Dia,https://www.elnuevodia.com/entretenimiento/cultura/notas/comedia-la-peor-cantante-del-mundo-abre-su-cuarta-funcion/
2022-08-14 00:00:00,Representantes del PNP proponen medidas severas para combatir la corrupción,"Presentarán un paquete de proyectos mañana, lunes, cuando arranca la sesión legislativa ordinaria",Gobierno,El Nuevo Dia,https://www.elnuevodia.com/noticias/gobierno/notas/representantes-del-pnp-proponen-medidas-severas-para-combatir-la-corrupcion/
2022-08-14 00:00:00,"Miguel Romero entrega equipo a la Policía Municipal de San Juan que se adquirió con $191,000","El alcalde de la capital anunció, además, que se remodeló el cuartel de la Unidad Canina",Seguridad,El Nuevo Dia,https://www.elnuevodia.com/noticias/seguridad/notas/miguel-romero-entrega-equipo-a-la-policia-municipal-de-san-juan-que-se-adquirio-con-191000/
2022-08-14 00:00:00,Salud reporta dos muertes adicionales y 358 hospitalizados con COVID-19,"Mientras, la tasa de positividad se ubicó en 31.38% en la actualización de mediodía",Locales,El Nuevo Dia,https://www.elnuevodia.com/noticias/locales/notas/salud-reporta-dos-muertes-adicionales-y-358-hospitalizados-con-covid-19/
2022-08-14 00:00:00,Así transcurrió la segunda jornada del Coca-Cola Music Fest,El evento sirvió de plataforma para figuras de la música urbana tanto en ascenso como ya establecidas,Música,El Nuevo Dia,https://www.elnuevodia.com/entretenimiento/musica/notas/asi-transcurrio-la-segunda-jornada-del-coca-cola-music-fest/
2022-08-14 00:00:00,“Bullet Train” lidera las taquillas por segunda semana consecutiva,"Después de recaudar unos $ 30 millones en su primer fin de semana, “Bullet Train” sumó $13.4 millones en su segunda semana",Películas y series,El Nuevo Dia,https://www.elnuevodia.com/entretenimiento/peliculas-series/notas/bullet-train-lidera-las-taquillas-por-segunda-semana-consecutiva/
2022-08-14 00:00:00,Sobre 200 personas se vacunan contra la viruela del mono en evento de Salud junto a organizaciones LGBTTIQ+,"Al momento, hay 50 casos confirmados en Puerto Rico",Locales,El Nuevo Dia,https://www.elnuevodia.com/noticias/locales/notas/sobre-200-personas-se-vacunan-contra-la-viruela-del-mono-en-evento-de-salud-junto-a-organizaciones-lgbttiq/
2022-08-14 00:00:00,Identifican al joven de 26 años asesinado frente a una gasolinera en Comerío,"En la escena se ocupó un arma de fuego, un cargador con 30 balas, $1,115 en efectivo, 25 bolsitas de cocaína y 29 de heroína",Seguridad,El Nuevo Dia,https://www.elnuevodia.com/noticias/seguridad/notas/identifican-al-joven-de-26-anos-asesinado-frente-a-una-gasolinera-en-comerio/
2022-08-14 00:00:00,Bailaora Siudy Garrido llevará su espectáculo “Flamenco íntimo” al Coca-Cola Music Hall,"La puesta en escena del espectáculo de esta artista venezolana, será el 4 de noviembre a las 8:30 p.m. en el Coca-Cola Music Hall",Música,El Nuevo Dia,https://www.elnuevodia.com/entretenimiento/musica/notas/bailaora-siudy-garrido-llevara-su-espectaculo-flamenco-intimo-al-coca-cola-music-hall/
2022-08-14 00:00:00,La Luna y Júpiter lucirán juntos esta noche,A partir de las 9:30 p.m. se observará el evento astronómico,Espacio y astronomía,El Nuevo Dia,https://www.elnuevodia.com/ciencia-ambiente/espacio-astronomia/notas/la-luna-y-jupiter-luciran-juntos-esta-noche/
2022-08-14 00:00:00,Acueductos amplía a 24 horas el periodo de interrupción de servicio en Isabela,La corporación pública informó que el plan se mantendrá en efecto hasta nuevo aviso debido a que todavía arreglan una enorme rotura,Locales,El Nuevo Dia,https://www.elnuevodia.com/noticias/locales/notas/acueductos-amplia-a-24-horas-el-periodo-de-interrupcion-de-servicio-en-isabela/
2022-08-14 00:00:00,Impugnan elección para la presidencia del PNP en Guayama ,"Alegan que hubo fraude en endosos que recibió Glorimari Jaime, quien prevaleció en la contienda",Política,El Nuevo Dia,https://www.elnuevodia.com/noticias/politica/notas/impugnan-eleccion-para-la-presidencia-del-pnp-en-guayama/
2022-08-14 00:00:00,Convocan marcha en Washington D. C. a favor de la estadidad para Puerto Rico,El movimiento es impulsado por la senadora Keren Riquelme y el expresidente cameral José Aponte Hernández,Locales,El Nuevo Dia,https://www.elnuevodia.com/noticias/locales/notas/convocan-marcha-en-washington-d-c-a-favor-de-la-estadidad-para-puerto-rico/
2022-08-14 00:00:00,Los agricultores (armados) de Irán,"¿Quién puede creer que Irán vendrá a Venezuela a producir alimentos y no a montar un parapeto agrícola, en el que ocultarán instalaciones y actividades militares?, escribe Miguel Henrique Otero  ",Para suscriptores,El Nuevo Dia,https://www.elnuevodia.com/opinion/punto-de-vista/los-agricultores-armados-de-iran/
2022-08-15 00:00:00,El final del Trumpismo,"Donald Trump ha sido el peor presidente en la historia de Estados Unidos, opina Carmelo Ríos  ",Para suscriptores,El Nuevo Dia,https://www.elnuevodia.com/opinion/punto-de-vista/el-final-del-trumpismo/
2022-08-15 00:00:00,Atrasado el cuarto partido de la final del BSN por humedad en el tabloncillo del Coliseo Arquelio Torres,Los Vaqueros y los Atléticos esperaron casi una hora para comenzar a jugar en San Germán,Baloncesto,El Nuevo Dia,https://www.elnuevodia.com/deportes/baloncesto/notas/atrasado-el-cuarto-partido-de-la-final-del-bsn-por-humedad-en-el-tabloncillo-del-coliseo-arquelio-torres/
2022-08-14 00:00:00,Kansas City pone fin a una racha de doce triunfos al hilo de los Dodgers,Los Ángeles estaba tratando de igualar una marca de la franquicia de trece lograda dos veces desde que el equipo se movió a la costa Oeste,Béisbol,El Nuevo Dia,https://www.elnuevodia.com/deportes/beisbol/notas/kansas-city-pone-fin-a-una-racha-de-doce-triunfos-al-hilo-de-los-dodgers/
2022-08-14 00:00:00,Albert Pujols enciende a los fans de San Luis con par de vuelacercas,"Fueron sus cuadrangulares 688 y 689 de su carrera, ocupando el cuarto puesto en la lista de todos los tiempos detrás de Barry Bonds, Hank Aaron, Babe Ruth y Alex Rodríguez",Béisbol,El Nuevo Dia,https://www.elnuevodia.com/deportes/beisbol/notas/albert-pujols-enciende-a-los-fans-de-san-luis-con-par-de-vuelacercas/
2022-08-14 00:00:00,"Estudiante del RUM recibe $10,000 de una prestigiosa beca de Google sobre videojuegos",Nicole Noemí Román Correa es la única joven matriculada en la Universidad de Puerto Rico en formar parte del grupo selecto de becados,Videojuegos,El Nuevo Dia,https://www.elnuevodia.com/tecnologia/videojuegos/notas/estudiante-del-rum-recibe-10000-de-una-prestigiosa-beca-de-google-sobre-videojuegos/
2022-08-14 00:00:00,Francisco Lindor establece una marca de carreras remolcadas en la franquicia,El siore puertorriqueño consiguió su impulsada número 82 de la temporada dejando atrás el récord que tenía José Reyes para un jugador del campocorto,Béisbol,El Nuevo Dia,https://www.elnuevodia.com/deportes/beisbol/notas/francisco-lindor-establece-una-marca-de-carreras-remolcadas-en-la-franquicia/
2022-08-14 00:00:00,Inmenso Glenn Monroig al celebrar 50 años de carrera en concierto,El cantautor puertorriqueño deleitó a su fanaticada al repasar su extenso repertorio compuesto tanto por canciones románticas como de denuncia social,Música,El Nuevo Dia,https://www.elnuevodia.com/entretenimiento/musica/notas/inmenso-glenn-monroig-al-celebrar-50-anos-de-carrera-en-concierto/
2022-08-14 00:00:00,El aumento en el nivel del agua complica el rescate de los 10 mineros atrapados en una mina en México,El accidente ocurrió hace 11 días y los familiares han exigido que se contraten rescatistas extranjeros,Mundo,El Nuevo Dia,https://www.elnuevodia.com/noticias/mundo/notas/el-aumento-en-el-nivel-del-agua-complica-el-rescate-de-los-10-mineros-atrapados-en-una-mina-en-mexico/
2022-08-14 00:00:00,¿Quiénes son los 10 más buscados del área de Carolina y qué delitos se les imputa?,"Tres de los prófugos tiene fianzas millonarias por asesinato, agresión sexual y violaciones a la Ley de Armas ",Seguridad,El Nuevo Dia,https://www.elnuevodia.com/noticias/seguridad/notas/quienes-son-los-10-mas-buscados-del-area-de-carolina-y-que-delitos-se-les-imputa/
2022-08-15 00:00:00,La actriz Carmen Villalobos se renueva en la cocina de Top Chef VIP,"La artista, famosa por protagonizar telenovelas como “Sin senos no hay paraíso”, “El Señor de los Cielos” y “Café con aroma de mujer”, se está dejando ver como nunca antes en este programa de Telemundo",Televisión,El Nuevo Dia,https://www.elnuevodia.com/entretenimiento/television/notas/la-actriz-carmen-villalobos-se-renueva-en-la-cocina-de-top-chef-vip/
2022-08-15 00:00:00,El flagelo de los accidentes azota a Cuba,"El calamitoso estado de la infraestructura y la maquinaria en Cuba conlleva un creciente riesgo de tragedias como las recientes catástrofes del hotel Saratoga y el puerto de Matanzas, escribe Roberto Orro",Para suscriptores,El Nuevo Dia,https://www.elnuevodia.com/opinion/punto-de-vista/el-flagelo-de-los-accidentes-azota-a-cuba/
2022-08-15 00:00:00,Meteorología emite advertencia de calor para casi 40 municipios,Se esperan índices de calor de hasta 111 grados Fahrenheit en algunos sectores,El Tiempo,El Nuevo Dia,https://www.elnuevodia.com/noticias/el-tiempo/notas/meteorologia-emite-advertencia-de-calor-para-casi-40-municipios/
2022-08-15 00:00:00,Asesinan de múltiples disparos a un joven de 24 años en Ponce,El cuerpo fue hallado en el pavimento cerca de la motora en la que viajaba al momento de los hechos,Seguridad,El Nuevo Dia,https://www.elnuevodia.com/noticias/seguridad/notas/asesinan-de-multiples-disparos-a-un-joven-de-24-anos-en-ponce/
2022-08-15 00:00:00,La tasa de positividad preliminar de COVID-19 amanece en 29.82%,El Departamento de Salud también reportó una muerte por el virus,Locales,El Nuevo Dia,https://www.elnuevodia.com/noticias/locales/notas/la-tasa-de-positividad-preliminar-de-covid-19-amanece-en-2982/
2022-08-15 00:00:00,Cambios en el CRIM: lección de mejoras oportunas en plataformas digitales,"Es necesario realizar mejor trabajo al implantar cambios en los portales digitales de las agencias gubernamentales, escribe Ricardo López de Victoria",Para suscriptores,El Nuevo Dia,https://www.elnuevodia.com/opinion/punto-de-vista/cambios-en-el-crim-leccion-de-mejoras-oportunas-en-plataformas-digitales/
2022-08-15 00:00:00,Agentes federales diligencian órdenes de arrestos contra empleados de muelles en San Juan,Los cargos están relacionados con la ley federal contra el crimen organizado conocida por sus siglas RICO Act,Seguridad,El Nuevo Dia,https://www.elnuevodia.com/noticias/seguridad/notas/agentes-federales-diligencian-ordenes-de-arrestos-contra-empleados-de-muelles-en-san-juan/
2022-08-15 00:00:00,La hipocresía de las perspectivas curriculares,"Carlos Díaz Olivo cuestiona ¿de qué perspectiva de enseñanza de género o de otra cosa se pueda hablar, si no somos capaces de dispensar el respeto básico que toda sociedad viene obligada a brindar a los adultos mayores?",Para suscriptores,El Nuevo Dia,https://www.elnuevodia.com/opinion/punto-de-vista/la-hipocresia-de-las-perspectivas-curriculares/
2022-08-15 00:00:00,La amplitud del concepto de perspectiva de género,"El amor y respeto por la diversidad surge del abarcador entendimiento lo que es la perspectiva de género, escribe Rubén David Bonilla Ramos",Para suscriptores,El Nuevo Dia,https://www.elnuevodia.com/opinion/desde-la-diaspora/la-amplitud-del-concepto-de-perspectiva-de-genero/
2022-08-15 00:00:00,Ángel Rodríguez defiende la decisión de posponer el cuarto juego de la final del BSN ,El armador de los Vaqueros de Bayamón indicó que los jugadores de ambos bandos tomaron la determinación de no jugar debido a la condición del tabloncillo en el Coliseo Arquelio Torres,Baloncesto,El Nuevo Dia,https://www.elnuevodia.com/deportes/baloncesto/notas/angel-rodriguez-defiende-la-decision-de-posponer-el-cuarto-juego-de-la-final-del-bsn/
2022-08-15 00:00:00,"Miss Universe Puerto Rico: imagen corporal, “belleza” y salud mental","Debemos cuestionar y rechazar los estándares de belleza que esclavizan, enferman y degradan a las personas, indica Vivian Rodríguez Del Toro",Para suscriptores,El Nuevo Dia,https://www.elnuevodia.com/opinion/punto-de-vista/miss-universe-puerto-rico-imagen-corporal-belleza-y-salud-mental/
2022-08-15 00:00:00,“Se desmanteló una empresa criminal”: agentes federales arrestan empleados de muelles en San Juan,"Stephen Muldrow, jefe de la fiscalía federal en Puerto Rico, indicó que el esquema por el que se les acusa fue de sobre $1 millón y que entre los arrestados figura el presidente del sindicato ILA",Seguridad,El Nuevo Dia,https://www.elnuevodia.com/noticias/seguridad/notas/se-desmantelo-una-empresa-criminal-agentes-federales-arrestan-empleados-de-muelles-en-san-juan/
2022-08-15 00:00:00,Ya está disponible en Puerto Rico la versión híbrida de la Toyota Tundra 2022,Esta “pick-up” ofrece más rendimiento de combustible sin sacrificar su potencia,Autos,El Nuevo Dia,https://www.elnuevodia.com/negocios/autos/notas/ya-esta-disponible-en-puerto-rico-la-version-hibrida-de-la-toyota-tundra-2022/
2022-08-15 00:00:00,Gran Bretaña autoriza versión actualizada de la vacuna de Moderna contra el COVID-19,Tiene como objetivo proteger contra el virus original y la variante ómicron,Mundo,El Nuevo Dia,https://www.elnuevodia.com/noticias/mundo/notas/gran-bretana-autoriza-version-actualizada-de-la-vacuna-de-moderna-contra-el-covid-19/
2022-08-15 00:00:00,Laura Bozzo y Daniella Navarro ganan “la mejor pelea” de “La Casa de los Famosos 2″,"Anoche se transmitió una gala especial con los mejores momentos de la temporada, donde se entregaron algunos premios especiales ",Televisión,El Nuevo Dia,https://www.elnuevodia.com/entretenimiento/television/notas/laura-bozzo-y-daniella-navarro-ganan-la-mejor-pelea-de-la-casa-de-los-famosos-2/
