date,title,summary,topic,media,link
2022-08-25,Crece el turismo en el Distrito de Convenciones durante el 2022,En los próximos meses las instalaciones recreativas contarán con una tienda al detal y una empresa que moverá oficinas a esta localidad,Economia,El Vocero,https://www.elvocero.com/economia/otros/crece-el-turismo-en-el-distrito-de-convenciones-durante-el-2022/article_ce2711dc-2409-11ed-b7d9-ab433f3e86b5.html
2022-08-24,El más bajo en una década: cae el Índice de Vivienda Asequible en la Isla,,Economia,El Vocero,https://www.elvocero.com/economia/el-m-s-bajo-en-una-d-cada-cae-el-ndice-de-vivienda-asequible-en/article_7312d72e-23ee-11ed-9570-0b64bf22a6fd.html
2022-08-24,Educación federal anuncia extensión de pago de préstamos estudiantiles hasta diciembre,"Este anuncio surge luego de que el presidente de Estados Unidos, Joe Biden, presentó un plan de cancelación de deudas para los estudiantes de hasta $20,000",Economia,El Vocero,https://www.elvocero.com/economia/finanzas/educaci-n-federal-anuncia-extensi-n-de-pago-de-pr-stamos-estudiantiles-hasta-diciembre/article_6f1576fa-23cf-11ed-8e15-0b27d1734e06.html
2022-08-24,La Asociación de Industriales asegura que el País no puede aceptar más excusas sobre el sistema eléctrico,La organización solicitó una mayor fiscalización de la empresa LUMA Energy por parte del gobierno local,Economia,El Vocero,https://www.elvocero.com/economia/otros/la-asociaci-n-de-industriales-asegura-que-el-pa-s-no-puede-aceptar-m-s/article_195428d6-23d6-11ed-b6b1-ffd5511e89db.html
2022-08-24,"Joe Biden anuncia un plan de cancelación de deudas de hasta $20,000 en préstamos estudiantiles",,Economia,El Vocero,https://www.elvocero.com/economia/finanzas/joe-biden-anuncia-un-plan-de-cancelaci-n-de-deudas-de-hasta-20-000-en/article_29a1dd0c-23c5-11ed-a222-b374531b8457.html
2022-08-24,En intensivo el sistema de salud de Puerto Rico,Aseguran que podría colapsar si se prolonga la crisis y no recibe dinero adicional,Economia,El Vocero,https://www.elvocero.com/economia/otros/en-intensivo-el-sistema-de-salud-de-puerto-rico/article_a6a1ee26-2354-11ed-8eb2-d773522478ba.html
2022-08-24,Continúa el ‘vapeo’ ilegal entre los menores de edad en Puerto Rico,Jóvenes desde los 13 años están consumiendo cigarrillos electrónicos,Economia,El Vocero,https://www.elvocero.com/economia/otros/contin-a-el-vapeo-ilegal-entre-los-menores-de-edad-en-puerto-rico/article_64c8a2d0-2352-11ed-81d6-373447eb7560.html
2022-08-23,El euro cae por debajo del dólar: ¿Cuál es el impacto?,,Economia,El Vocero,https://www.elvocero.com/economia/otros/el-euro-cae-por-debajo-del-d-lar-cu-l-es-el-impacto/article_38e8e8a4-22e5-11ed-a316-0b6cd7abc60e.html
2022-08-23,Cinco consejos para hacer un presupuesto y organizar tus finanzas,,Economia,El Vocero,https://www.elvocero.com/economia/finanzas/cinco-consejos-para-hacer-un-presupuesto-y-organizar-tus-finanzas/article_b016c7a4-231a-11ed-9ad2-6f72cbd16411.html
2022-08-23,Denuncian a la red social Twitter por negligencia de ciberseguridad,,Economia,El Vocero,https://www.elvocero.com/economia/tecnologia/denuncian-a-la-red-social-twitter-por-negligencia-de-ciberseguridad/article_1de7c09e-2316-11ed-a6f9-836075eb0dca.html
2022-08-23,Servicios Generales responsabiliza a las agencias gubernamentales,"Para evitar la dilación en el pago a los suplidores y el endeudamiento, las compras no se inician si los fondos no están disponibles",Economia,El Vocero,https://www.elvocero.com/economia/otros/servicios-generales-responsabiliza-a-las-agencias-gubernamentales/article_7634ee56-2281-11ed-aedd-0b4896e921f7.html
2022-08-23,Inflación provoca más presión fuera del área metropolitana,"En el costo de la gasolina en los pueblos montañosos se pudiese percibir casi 10% de aumento, mientras que en la zona metropolitana se observa un incremento de 5%",Economia,El Vocero,https://www.elvocero.com/economia/finanzas/inflaci-n-provoca-m-s-presi-n-fuera-del-rea-metropolitana/article_a88e9128-2280-11ed-a7a6-eb87728a35bc.html
2022-08-25,Muestra un poder desconocido,"Sylvester Stallone en Samaritan, que estrena mañana en Prime Video",Escenario,El Vocero,https://www.elvocero.com/escenario/cine/muestra-un-poder-desconocido/article_4a2b16a0-23f8-11ed-8082-bf7ddacee41b.html
2022-08-25,Estrenos de cine y 'streaming',,Escenario,El Vocero,https://www.elvocero.com/escenario/cine/estrenos-de-cine-y-streaming/article_1c8e8c56-23fb-11ed-8767-e3f98e04599c.html
2022-08-25,Cuatro siglos de historia en Muestra Legado,"La exhibición, que incluye 107 piezas, inaugura la Galería La Sede del ICP",Escenario,El Vocero,https://www.elvocero.com/escenario/cultura/cuatro-siglos-de-historia-en-muestra-legado/article_e716d040-23fc-11ed-a814-bf58de16965b.html
2022-08-24,Vídeo: Giselle Blondet fue víctima de comentarios despectivos en las redes sociales,,Escenario,El Vocero,https://www.elvocero.com/escenario/farandula/v-deo-giselle-blondet-fue-v-ctima-de-comentarios-despectivos-en-las-redes-sociales/article_b15941a2-23e5-11ed-ae60-f72bfec95a0b.html
2022-08-24,Comienzan las semifinales del Concurso Nacional de Trovadores del Instituto de Cultura Puertorriqueña,"Este próximo domingo, 28 de agosto",Escenario,El Vocero,https://www.elvocero.com/escenario/cultura/comienzan-las-semifinales-del-concurso-nacional-de-trovadores-del-instituto-de-cultura-puertorrique-a/article_407e5b3e-23e0-11ed-80a0-c757d3b83fc1.html
2022-08-24,Sylvia Hernández se une a Día a Día,Conoce a partir de cuando,Escenario,El Vocero,https://www.elvocero.com/escenario/television/sylvia-hern-ndez-se-une-a-d-a-a-d-a/article_c5ed2182-23dc-11ed-9574-2fc5297efd31.html
2022-08-24,¿Cuál es la cifra que Bad Bunny cobra por concierto?,Entérate aquí ,Escenario,El Vocero,https://www.elvocero.com/escenario/farandula/cu-l-es-la-cifra-que-bad-bunny-cobra-por-concierto/article_7a707aec-23c3-11ed-a054-57d86de4ad7b.html
2022-08-24,Bad Bunny lanza otra descarga contra LUMA: esta vez en su concierto en Washington DC,“LUMA se va a tener que ir pa’l cara@# y par de gente también”,Escenario,El Vocero,https://www.elvocero.com/escenario/otros/bad-bunny-lanza-otra-descarga-contra-luma-esta-vez-en-su-concierto-en-washington-dc/article_53cd4210-23ac-11ed-93e9-27fa8ce0dd44.html
2022-08-24,Pavel Núñez salda deuda emocional con Víctor Víctor,"En su reciente disco, Pavel Trópico",Escenario,El Vocero,https://www.elvocero.com/escenario/espectaculos/pavel-n-ez-salda-deuda-emocional-con-v-ctor-v-ctor/article_3b6abf9c-2337-11ed-a578-8bfde34511dd.html
2022-08-24,Manolo Ramos revela el secreto de su musa,"El cantante invita a salir de la codependencia al ritmo de Mala mía, me fui ",Escenario,El Vocero,https://www.elvocero.com/escenario/espectaculos/manolo-ramos-revela-el-secreto-de-su-musa/article_53a864a0-2338-11ed-bb10-67c956ef0eff.html
2022-08-24,"Se asoma una película, una serie y un libro de Frankie Ruiz","“Se lo merece el público”, asegura su hijo, Frankie Ruiz Jr. ",Escenario,El Vocero,https://www.elvocero.com/escenario/espectaculos/se-asoma-una-pel-cula-una-serie-y-un-libro-de-frankie-ruiz/article_f7070288-2337-11ed-908c-a701a72b1c7a.html
2022-08-24,Jasond Calderón logra meta en la tv boricua con su llegada a Raymond y sus Amigos,Espera integrar algunos de los personajes con los que se ha dado a conocer en redes sociales,Escenario,El Vocero,https://www.elvocero.com/escenario/television/jasond-calder-n-logra-meta-en-la-tv-boricua-con-su-llegada-a-raymond-y/article_8cab1baa-2336-11ed-b96d-67c585c63c94.html
2022-08-23,El merenguero Elvis Crespo reacciona al nuevo vídeo de Bad Bunny inspirado en “Suavemente”,"“Que utilice algo inspirado en mi arte, eso me hace sentir muy agradecido”, expresó la voz de Píntame ",Escenario,El Vocero,https://www.elvocero.com/escenario/farandula/el-merenguero-elvis-crespo-reacciona-al-nuevo-v-deo-de-bad-bunny-inspirado-en-suavemente/article_2446b196-2318-11ed-9450-1bf6d8f2ff06.html
2022-08-23,Jasond Calderón se integra al elenco de Raymond y sus Amigos,El actor cuenta con dos décadas de trayectoria,Escenario,El Vocero,https://www.elvocero.com/escenario/television/jasond-calder-n-se-integra-al-elenco-de-raymond-y-sus-amigos/article_b1bb7ff4-22f8-11ed-89d7-dfc42d224280.html
2022-08-23,¿Se unirá Bad Bunny al piquete contra LUMA Energy?,Se expresó a través de sus redes sociales,Escenario,El Vocero,https://www.elvocero.com/escenario/farandula/se-unir-bad-bunny-al-piquete-contra-luma-energy/article_c6498b1a-2306-11ed-9a7e-5fe555f40609.html
2022-08-23,"""House of the Dragon"" es el estreno más visto en la historia de la cadena HBO",,Escenario,El Vocero,https://www.elvocero.com/escenario/television/house-of-the-dragon-es-el-estreno-m-s-visto-en-la-historia-de-la/article_c25f3858-2322-11ed-a6cc-271ebacc1e00.html
2022-08-23,"¿Demandará Florinda Meza a Shakira por copiar movimientos de ""El Chavo del 8""?",La actriz mexicana rompió el silencio,Escenario,El Vocero,https://www.elvocero.com/escenario/otros/demandar-florinda-meza-a-shakira-por-copiar-movimientos-de-el-chavo-del-8/article_cb97af44-2305-11ed-a6eb-cbd616e3a627.html
2022-08-23,Ricky Martin se posiciona en el primer lugar de listas de Billboard,Con el tema ‘A veces bien y a veces mal’ en colaboración con el grupo mexicano Reik,Escenario,El Vocero,https://www.elvocero.com/escenario/farandula/ricky-martin-se-posiciona-en-el-primer-lugar-de-listas-de-billboard/article_f853268c-2303-11ed-91ec-0b3fb6710a83.html
2022-08-23,"Ednita Nazario llevará su concierto ""La Más Loca, La Más Bella"" a Estados Unidos",Conoce dónde serán las primeras paradas,Escenario,El Vocero,https://www.elvocero.com/escenario/espectaculos/ednita-nazario-llevar-su-concierto-la-m-s-loca-la-m-s-bella-a-estados/article_b1f3ca88-22ff-11ed-aa0b-abe11da2c06b.html
2022-08-23,Conexión caribeña en Transcromático,Juan Carlos Amador expone en St. Thomas,Escenario,El Vocero,https://www.elvocero.com/escenario/cultura/conexi-n-caribe-a-en-transcrom-tico/article_36bfc414-2270-11ed-a44a-9382fc648e78.html
2022-08-23,Meta superada para Raymond Arrieta y Da Vida,"El comediante revalidó su compromiso para el 2023 y confirmó el recaudo de $1,265,700",Escenario,El Vocero,https://www.elvocero.com/escenario/television/meta-superada-para-raymond-arrieta-y-da-vida/article_ade701f6-2270-11ed-adb0-b389a5f3e031.html
2022-08-23,A romper la cuarta pared,Pedro Orlando Torres y Efraín Rosa adelantan cómo el público se integra al montaje de La Santa Noche del Sábado,Escenario,El Vocero,https://www.elvocero.com/escenario/teatro/a-romper-la-cuarta-pared/article_d3a5011e-226f-11ed-a867-b3b4eed47382.html
2022-08-25,Extraditan a Puerto Rico al notorio narcotraficante dominicano “Julito Kilo”,La Oficina de Asuntos Internacionales del Departamento de Justicia brindó asistencia significativa para asegurar el arresto y la extradición de De Los Santos-Bautista de la República Dominicana,Ley y Orden,El Vocero,https://www.elvocero.com/ley-y-orden/federal/extraditan-a-puerto-rico-al-notorio-narcotraficante-dominicano-julito-kilo/article_d819041c-24ad-11ed-97c9-4fd39d4e3336.html
2022-08-25,Confiscan millones de dólares de cocaína y detienen a ocho contrabandistas en  la costa de San Juan,,Ley y Orden,El Vocero,https://www.elvocero.com/ley-y-orden/federal/confiscan-millones-de-d-lares-de-coca-na-y-detienen-a-ocho-contrabandistas-en-la/article_dbaa380e-24ac-11ed-8529-5b7e7f43c006.html
2022-08-25,Citan al tribunal a las tres personas detenidas durante un operativo en la barriada La Perla,El arresto ocurrió luego de que agentes del Negociado de Drogas intervinieran con unos supuestos sicarios fuertemente armados,Ley y Orden,El Vocero,https://www.elvocero.com/ley-y-orden/justicia/citan-al-tribunal-a-las-tres-personas-detenidas-durante-un-operativo-en-la-barriada-la/article_a45872e4-24a2-11ed-88e6-9fd7cd0c6df4.html
2022-08-25,Conceden tiempo extra al exayudante del exalcalde Trujillo Alto para evaluar contraoferta de pliego,Conoce lo más reciente del caso,Ley y Orden,El Vocero,https://www.elvocero.com/ley-y-orden/federal/conceden-tiempo-extra-al-exayudante-del-exalcalde-trujillo-alto-para-evaluar-contraoferta-de-pliego/article_66a8ac76-24a1-11ed-a67c-17c5869943cf.html
2022-08-25,Un hombre pierde la vida al resbalar en una bañera en Hato Rey,Una llamada a través del Sistema de Emergencias 9-1-1 alertó a las autoridades,Ley y Orden,El Vocero,https://www.elvocero.com/ley-y-orden/policiacas/un-hombre-pierde-la-vida-al-resbalar-en-una-ba-era-en-hato-rey/article_9459d26e-2495-11ed-a7d8-37932f1cbbfd.html
2022-08-25,La Policía captura en Peñuelas a un hombre buscado por agredir a su pareja,La perjudicada tuvo que recibir asistencia médica en una institución hospitalaria,Ley y Orden,El Vocero,https://www.elvocero.com/ley-y-orden/policiacas/la-polic-a-captura-en-pe-uelas-a-un-hombre-buscado-por-agredir-a-su/article_cc58a058-2492-11ed-a440-abbd6d22913a.html
2022-08-25,Identifican a la mujer asesinada hoy por su expareja en Quebradillas,"Según la investigación de las autoridades, el hombre, quien luego de asesinar a la mujer se privó de la vida, había regresado ayer a la Isla procedente de los Estados Unidos ",Ley y Orden,El Vocero,https://www.elvocero.com/ley-y-orden/policiacas/identifican-a-la-mujer-asesinada-hoy-por-su-expareja-en-quebradillas/article_df2b85c2-2467-11ed-8f4b-a3293f0852b8.html
2022-08-25,Un asaltante se lleva cigarrillos y canecas de una gasolinera en Lares,También se robó dos vitrinas transparentes con boletos de juegos instantáneos de la Lotería Electrónica y dinero en efectivo,Ley y Orden,El Vocero,https://www.elvocero.com/ley-y-orden/policiacas/un-asaltante-se-lleva-cigarrillos-y-canecas-de-una-gasolinera-en-lares/article_89f7e484-2475-11ed-95cd-7785731045cc.html
2022-08-25,Vídeo: Manifestantes expulsan a Tatito Hernández de la protesta en contra de LUMA,,Gobierno,El Vocero,https://www.elvocero.com/gobierno/politica/v-deo-manifestantes-expulsan-a-tatito-hern-ndez-de-la-protesta-en-contra-de-luma/article_dc80ef9e-24c9-11ed-aac1-c76a1eef8173.html
2022-08-25,Realizan la primera graduación de la escuela de apicultores en San Lorenzo,Este importante curso se llevó a cabo en colaboración con Apiario Guare el cual permite certificar a más apicultores,Gobierno,El Vocero,https://www.elvocero.com/gobierno/municipal/realizan-la-primera-graduaci-n-de-la-escuela-de-apicultores-en-san-lorenzo/article_aaada5c0-24ba-11ed-9e1e-138640daa940.html
2022-08-25,El Departamento de Salud insta a los hospitales a estar listos ante una emergencia,En las visitas se evaluará el registro de mantenimiento de los generadores de emergencia y cisterna,Gobierno,El Vocero,https://www.elvocero.com/gobierno/agencias/el-departamento-de-salud-insta-a-los-hospitales-a-estar-listos-ante-una-emergencia/article_17069bc2-24b7-11ed-9438-774cc89b4f06.html
2022-08-25,"El secretario auxiliar de la Gobernación Para Asuntos Energéticos devengará un salario anual de $108,000",Francisco Berríos Portela comenzará funciones el próximo 1 de septiembre y será el único empleado de la dependencia,Gobierno,El Vocero,https://www.elvocero.com/gobierno/fortaleza/el-secretario-auxiliar-de-la-gobernaci-n-para-asuntos-energ-ticos-devengar-un-salario-anual/article_e0a4f4c8-249a-11ed-9f76-4b44dd121318.html
2022-08-25,"Se registran 1,732 nuevos casos positivos de covid-19",,Gobierno,El Vocero,https://www.elvocero.com/gobierno/agencias/se-registran-1-732-nuevos-casos-positivos-de-covid-19/article_072865b0-245c-11ed-a8ba-17e1d517d122.html
2022-08-25,El director de la Autoridad para las Alianzas Público Privadas no le da una buena nota a LUMA,"Fermín Fontanés reconoció que la compañía no ha cumplido con todas las métricas, incluyendo la duración de los apagones",Gobierno,El Vocero,https://www.elvocero.com/gobierno/legislatura/el-director-de-la-autoridad-para-las-alianzas-p-blico-privadas-no-le-da-una/article_17e36c14-248f-11ed-bd4a-e7f66707d90c.html
2022-08-25,Asociación de Maestros advierte que el incumplimiento de LUMA afecta el proceso educativo en las escuelas,La organización se unió al “llamado colectivo” que solicita a la administración del gobernador Pedro Pierluisi tomar acción ante los apagones masivos,Gobierno,El Vocero,https://www.elvocero.com/gobierno/agencias/asociaci-n-de-maestros-advierte-que-el-incumplimiento-de-luma-afecta-el-proceso-educativo-en/article_e17eb848-248b-11ed-8cf3-0bc5e33e33fc.html
2022-08-25,Dramático triunfo de Puerto Rico sobre Brasil en el inicio de la ventana FIBA,Los nuevos talentos boricuas fueron claves en la victoria de 75-72 en el partido celebrado en el coliseo Roberto Clemente ,Deportes,El Vocero,https://www.elvocero.com/deportes/baloncesto/dram-tico-triunfo-de-puerto-rico-sobre-brasil-en-el-inicio-de-la-ventana-fiba/article_ad04a92e-24e5-11ed-aa10-f365c776ed27.html
2022-08-25,Segunda victoria de Puerto Rico en la Copa Panamericana,"Las boricuas vencieron en tres cómodos parciales a la representación de Costa Rica para así asegurar su avance a la segunda ronda del torneo que se celebra en Hermosillo, México",Deportes,El Vocero,https://www.elvocero.com/deportes/voleibol/segunda-victoria-de-puerto-rico-en-la-copa-panamericana/article_11fdabb6-24c6-11ed-b5b7-fbb5761957a5.html
2022-08-25,Gerant Vega subirá a la loma en el primer juego de Puerto Rico en el Mundial Sub-15,,Deportes,El Vocero,https://www.elvocero.com/deportes/beisbol/gerant-vega-subir-a-la-loma-en-el-primer-juego-de-puerto-rico-en-el/article_8af9c70a-24c3-11ed-b490-3b41e47f9a1a.html
2022-08-25,Salinas y Cayey disputarán crucial juego en la serie final del Béisbol Doble A,El baile de coronación del torneo federativo favorece 2-0 a los Peces Voladores,Deportes,El Vocero,https://www.elvocero.com/deportes/beisbol/salinas-y-cayey-disputar-n-crucial-juego-en-la-serie-final-del-b-isbol-doble/article_7078068e-24a6-11ed-b26b-d3d064816924.html
2022-08-25,El tenista Novak Djokovic se perderá otro torneo por no estar vacunado contra el covid-19,El deportista no puede viajar a Estados Unidos,Deportes,El Vocero,https://www.elvocero.com/deportes/tenis/el-tenista-novak-djokovic-se-perder-otro-torneo-por-no-estar-vacunado-contra-el-covid/article_0ee74d2c-2496-11ed-8234-2baf516bbae2.html
2022-08-25,Un conjunto joven de Puerto Rico será puesto a la prueba en la cuarta ventana clasificatoria de FIBA,"Una remozada selección nacional enfrentará esta noche a la poderosa escuadra de Brasil, en el inicio de la cuarta ventana clasificatoria al Mundial de FIBA",Deportes,El Vocero,https://www.elvocero.com/deportes/baloncesto/un-conjunto-joven-de-puerto-rico-ser-puesto-a-la-prueba-en-la-cuarta-ventana/article_8604ac5c-240e-11ed-941d-efae1a74436f.html
2022-08-25,Cuidado con Declarador en la tercera carrera,Enfrenta cinco rivales en el evento que inicia el Pool de cinco ,Deportes,El Vocero,https://www.elvocero.com/deportes/hipismo/cuidado-con-declarador-en-la-tercera-carrera/article_db0a157a-2418-11ed-bdef-fbc383822ed7.html
2022-08-25,Lista la Isla para su primera Copa Mundial de Béisbol Sub-15,,Deportes,El Vocero,https://www.elvocero.com/deportes/beisbol/lista-la-isla-para-su-primera-copa-mundial-de-b-isbol-sub-15/article_081170e4-2410-11ed-b964-170637cb58b8.html
2022-08-25,Invitan a participar de ferias masivas de empleos en Ponce y San Juan,Decenas de patronos estarán reclutando personal necesario para cubrir posiciones a tiempo completo y parcial,Economia,El Vocero,https://www.elvocero.com/economia/otros/invitan-a-participar-de-ferias-masivas-de-empleos-en-ponce-y-san-juan/article_7d149148-2486-11ed-8981-6f5bcdf30dcd.html
2022-08-25,Respiro al bolsillo de los deudores de préstamos estudiantiles,"Biden cancela casi $300,000 millones en préstamos y extiende la moratoria en el pago de la deuda restante hasta el 31 de diciembre de 2022",Economia,El Vocero,https://www.elvocero.com/economia/finanzas/respiro-al-bolsillo-de-los-deudores-de-pr-stamos-estudiantiles/article_423acc54-2413-11ed-bb36-5f23262e7a7b.html
2022-08-25,Llama a vigilar la igualdad en el empleo,"No se puede discriminar por razón de sexo, raza, edad, género o discapacidades",Economia,El Vocero,https://www.elvocero.com/economia/otros/llama-a-vigilar-la-igualdad-en-el-empleo/article_cff0f320-23ff-11ed-b786-bf3082ae3985.html
2022-08-26,Lo que no sabías de Ashley Ann Cariño,Conoce qué superpoder le gustaría tener a la nueva MUPR ,Escenario,El Vocero,https://www.elvocero.com/escenario/moda-y-belleza/lo-que-no-sab-as-de-ashley-ann-cari-o/article_02c50298-24c6-11ed-895f-9b1cd6cd2d93.html
2022-08-26,Nueva vida a la música de Selena,"Canciones que la Reina del Tex Mex grabó entre los 13 y 16 años, fueron manipuladas a través de nuevas tecnologías para madurar la voz y acercarla a la realidad del momento de su fallecimiento, hace 27 años ",Escenario,El Vocero,https://www.elvocero.com/escenario/espectaculos/nueva-vida-a-la-m-sica-de-selena/article_e67f7bc2-24c0-11ed-a273-c33924184569.html
2022-08-25,Karol G se une a Maldy al ritmo de Gatúbela,"La colombiana se prepara para una nueva gira, que la llevará por 30 ciudades de Estados Unidos",Escenario,El Vocero,https://www.elvocero.com/escenario/espectaculos/karol-g-se-une-a-maldy-al-ritmo-de-gat-bela/article_ea88a7c2-24be-11ed-b60a-1ffd846aac02.html
2022-08-25,Anuel AA apoya manifestación contra LUMA Energy,"""Siempre lo que sea por el pueblo de Puerto Rico lo voy a apoyar"", dijo el artista ",Escenario,El Vocero,https://www.elvocero.com/escenario/farandula/anuel-aa-apoya-manifestaci-n-contra-luma-energy/article_dcbeaacc-24c0-11ed-9e60-e7c533b19779.html
2022-08-25,El Instituto de Cultura Puertorriqueña celebrará nuevamente el Mercado Ballajá,"Este domingo, 28 de agosto",Escenario,El Vocero,https://www.elvocero.com/escenario/cultura/el-instituto-de-cultura-puertorrique-a-celebrar-nuevamente-el-mercado-ballaj/article_4656eeba-24b0-11ed-911d-a3336990e7c5.html
2022-08-25,Karol G habla sobre su estreno como actriz en Netflix y del papel que rechazó en Aquaman,"Además, reveló que tiene intenciones de presentarse en el Estadio Hiram Bithorn ",Escenario,El Vocero,https://www.elvocero.com/escenario/farandula/karol-g-habla-sobre-su-estreno-como-actriz-en-netflix-y-del-papel-que-rechaz/article_d29139ca-2493-11ed-a48e-f7607da7d3d9.html
2022-08-25,Reconocen a Picando Alante como Mejor Largometraje Nacional,En el Puerto Rico Film Festival ,Escenario,El Vocero,https://www.elvocero.com/escenario/cine/reconocen-a-picando-alante-como-mejor-largometraje-nacional/article_c5975a5c-2483-11ed-868e-d354eecb2491.html
2022-08-25,Jangueando en el wikén,,Escenario,El Vocero,https://www.elvocero.com/escenario/espectaculos/jangueando-en-el-wik-n/article_d547bbde-23f9-11ed-9f58-4f7aabf8f83b.html
2022-08-30,Para largo la investigación al comité de campaña de Wanda Vázquez,Esperarán a que concluya el caso federal,Ley y Orden,El Vocero,https://www.elvocero.com/ley-y-orden/justicia/para-largo-la-investigaci-n-al-comit-de-campa-a-de-wanda-v-zquez/article_834ac7a6-280c-11ed-882c-97ade17e5e83.html
2022-08-29,El Departamento de Justicia recomienda un FEI contra el alcalde de Arecibo,Por malversación de fondos públicos,Ley y Orden,El Vocero,https://www.elvocero.com/ley-y-orden/justicia/el-departamento-de-justicia-recomienda-un-fei-contra-el-alcalde-de-arecibo/article_a2db72b8-27d6-11ed-bb56-df72b3667730.html
2022-08-29,Arrestan a uno de los más buscados de la zona policíaca de Carolina,"Se le fijó una fianza de $600,000 ",Ley y Orden,El Vocero,https://www.elvocero.com/ley-y-orden/policiacas/arrestan-a-uno-de-los-m-s-buscados-de-la-zona-polic-aca-de-carolina/article_13bcb14a-27e1-11ed-bf71-43ca184d0fee.html
2022-08-29,Le roban los aros con gomas y estribos a una guagua en Orocovis,"La propiedad hurtada fue valorada en $3,800",Ley y Orden,El Vocero,https://www.elvocero.com/ley-y-orden/policiacas/le-roban-los-aros-con-gomas-y-estribos-a-una-guagua-en-orocovis/article_b2057b00-27d9-11ed-9c76-bbbedd468999.html
2022-08-29,Conceden órdenes de protección contra juez Josian Rivera Torres y su exesposa,Ambos las solicitaron,Ley y Orden,El Vocero,https://www.elvocero.com/ley-y-orden/justicia/conceden-rdenes-de-protecci-n-contra-juez-josian-rivera-torres-y-su-exesposa/article_cd9944b2-27a9-11ed-957a-536bb9209cda.html
2022-08-29,El gobierno enfrentará a la Junta de Control Fiscal en los tribunales por la Reforma Laboral,Para el primer ejecutivo es importante mejorar las ofertas de empleo y que se ofrezca un periodo de vacaciones razonable,Ley y Orden,El Vocero,https://www.elvocero.com/ley-y-orden/justicia/el-gobierno-enfrentar-a-la-junta-de-control-fiscal-en-los-tribunales-por-la-reforma/article_5a9aad28-27ce-11ed-bad1-d7e177739270.html
2022-08-29,La Policía investiga un “carjacking” en San Juan,El crimen ocurrió a las 9:45 de la mañana,Ley y Orden,El Vocero,https://www.elvocero.com/ley-y-orden/policiacas/la-polic-a-investiga-un-carjacking-en-san-juan/article_fd738f3a-27cc-11ed-8bad-276d5d0abcd6.html
2022-08-29,Investigan carjackings en San Juan y Dorado,"En uno de los casos, los asaltantes se detuvieron a ""ayudar"" a la víctima a cambiar una goma",Ley y Orden,El Vocero,https://www.elvocero.com/ley-y-orden/policiacas/investigan-carjackings-en-san-juan-y-dorado/article_ab12b702-27c2-11ed-982f-e7839b025ace.html
2022-08-29,Gobierno recluta nuevos fiscales para reactivar el programa Drug Court,Buscan reducir la incidencia por crímenes motivados por abuso de drogas,Ley y Orden,El Vocero,https://www.elvocero.com/ley-y-orden/justicia/gobierno-recluta-nuevos-fiscales-para-reactivar-el-programa-drug-court/article_d3bc600c-27ba-11ed-8ace-2fe3591d3340.html
